{
  "$schema": "https://json-schema.org/draft/2020-12/schema",
  "$id": "https://dotacni-majak.cz/schema/v1/project-indicator.schema.json",
  "title": "ProjectIndicator",
  "type": "object",
  "additionalProperties": false,
  "required": [
    "schemaVersion",
    "id",
    "grantCallVersionId",
    "indicatorCode",
    "indicatorName",
    "necessity",
    "evidenceId",
    "completenessStatus",
    "verificationStatus",
    "sortOrder"
  ],
  "properties": {
    "schemaVersion": {"const": "1.0.0"},
    "id": {"type": "string", "minLength": 1},
    "grantCallVersionId": {"type": "string", "minLength": 1},

    "indicatorCode": {
      "description": "Official indicator code from the funding source (e.g. KPI table row id).",
      "type": "string",
      "minLength": 1
    },
    "indicatorName": {
      "description": "Human label of the indicator as published by the funding source.",
      "type": "string",
      "minLength": 1
    },
    "indicatorUnit": {
      "description": "Measurement unit as published (e.g. 't CO2-eq', 'M EUR', 'jm', '%'); null when not specified.",
      "type": ["string", "null"]
    },
    "indicatorCategory": {
      "description": "Optional grouping of the indicator (environmental, economic, social, digital, other).",
      "type": ["string", "null"],
      "enum": [
        "ENVIRONMENTAL",
        "ECONOMIC",
        "SOCIAL",
        "DIGITAL",
        "OTHER"
      ]
    },

    "necessity": {
      "description": "Whether the indicator always applies, is conditional, or is recommended.",
      "enum": ["REQUIRED", "CONDITIONAL", "RECOMMENDED"]
    },
    "conditionGroupId": {
      "description": "Optional reference to an eligibility RuleGroup gating applicability of this indicator.",
      "type": ["string", "null"],
      "minLength": 1
    },

    "baseline": {
      "description": "Baseline figure as published (free text when the source states it non-numerically).",
      "type": ["string", "null"]
    },
    "targetValue": {
      "description": "Numeric target when the source publishes a number; null when not specified.",
      "type": ["number", "null"]
    },
    "targetDirection": {
      "description": "Intended direction of the target when published.",
      "type": ["string", "null"],
      "enum": ["INCREASE", "DECREASE", "REACH", "MAINTAIN"]
    },
    "targetPeriodType": {
      "description": "Reporting period for the target when published.",
      "type": ["string", "null"],
      "enum": ["PER_PROJECT", "PER_YEAR", "PER_MONTH", "ONCE"]
    },

    "evidenceId": {
      "description": "FieldEvidence reference anchoring this indicator row to an immutable source document.",
      "type": ["string", "null"],
      "minLength": 1
    },
    "completenessStatus": {
      "description": "Whether the indicator (and its target) is complete, partial, or unknown from the official source.",
      "enum": ["COMPLETE", "PARTIAL", "UNKNOWN"]
    },
    "verificationStatus": {
      "description": "Distinguishes official extracted fact from user input.",
      "enum": [
        "AUTO_EXTRACTED",
        "PARTIALLY_VERIFIED",
        "VERIFIED",
        "NEEDS_REVIEW"
      ]
    },

    "sortOrder": {
      "description": "Deterministic ordering of indicators within a GrantCallVersion.",
      "type": "integer",
      "minimum": 0
    }
  }
}
